Salary Estimate,Job Description,Rating,Company Name,Location,Headquarters,Size,Founded,Type of ownership,Industry,Sector,Revenue,Competitors,hourly,employer_Provided,min_salary,max_salary,avg_salary,company_txt,job_state,some_state,age,python_yn,R_yn,Spark
$41K-$87K (Glassdoor est.),"Machine Learning Engineer
Aurora, COApply Now
Are you interested in supporting the ever-changing technology needs of the U.S. Government by providing services that support defense initiatives? Come look at Stratagem, where we help the U.S. Government solve some of the most challenging and interesting problems in the world.

Stratagem is hiring motivated, creative, and technically-minded individuals with a passion and skill for building state-of-the-art technologies. What is most important to us at Stratagem is candidates have exceptional problem-solving skills, are creative out-of-the-box thinkers, and are comfortable with quickly learning, evaluating, and deploying new technologies. Successful employees are self-starters, excellent communicators, and positive individuals with a passion for delivering the highest quality products.

** TS – SSBI REQUIRED**
** US CITIZENSHIP REQUIRED **

This is a Software Engineer position in Aurora, CO, and we are not hiring your average Java Joe’s. We are looking for the Macchiato with a double shot. You will be given substantial feature ownership, and we'll expect you to contribute product ideas as well as code. Your ideas will help shape the future of Stratagem.

Responsibilities & Skills
Our ideal candidate is a programming expert with a passion for machine learning. We need someone with prior experience designing and implementing modern machine-learning and computer-vision concepts and algorithms, and who stays up to date on all best-practice standards.
As a software engineer, your responsibilities include:
Investigating and solving exciting and difficult challenges in image recognition, classification, content analysis, and deep learning
Integrating with a diverse team to deliver in an agile-like manner
Developing new algorithms
Contributing to building aspects of a web-accessible system
Prototyping ideas/concepts to prove a solution quickly
Your core skills/experience include:
IAT Level II or III certification (i.e. Security+ or CISSP or CASP) within 90 days of hire
Expertise in one of the following: Java, Python, C++, etc.
Proficiency with containerization - Docker preferred
Proficiency with cloud Infrastructure - AWS or C2S preferred
Proficiency with PostgreSQL – or similar GIS database concepts
Experience with Hadoop, Spark, etc.
Experience developing and implementing Image Classification and Content Analysis
Experience with neural networks, K-means, etc.
Experience working with deep learning frameworks, such as Caffe, TensorFlow and Theano
3-15 years’ experience
You are the proud owner of a TS/SCI SSBI clearance
Bonus points if you have experience in any of the following:
DevSecOps experience
In-depth understanding of modern best-practices, such as Kaggle competition winners
Comfortable with statistics and data science concepts
Mission Management
SIGINT experience
About you
You are an exceptional problem solver, a quick learner, and a creative out-of-the-box thinker who values team work. You are comfortable with the pace and ever-changing requirements of a small development company while maintaining a healthy work life balance.

Who is Stratagem
Stratagem is a small and fast-growing technology company built around the idea that we can make a lasting impact for our customers and employees. We believe in a culture of innovation, fun, empowerment, and family. We want you to learn new skills so you can become more fulfilled in both your personal and professional life.

At Stratagem, our goal is to make our company the last company you work for!",4.3,"Stratagem Group
4.3","Aurora, CO","Aurora, CO",1 to 50 employees,2007,Company - Private,Aerospace & Defense,Aerospace & Defense,Unknown / Non-Applicable,-1,0,0,41,87,64.0,"Stratagem Group
", CO,1,13,1,0,1
$100K-$140K (Glassdoor est.),Intuit is hiring a Staff Data scientist to focus on our Consumer Tax Group. We are looking for exceptional talent that can improve the bottom lines of our TurboTax offerings.,4.4,"Intuit - Data
4.4","San Diego, CA","Mountain View, CA",5001 to 10000 employees,1983,Company - Public,Computer Hardware & Software,Information Technology,$2 to $5 billion (USD),"Square, PayPal, H&R Block",0,0,100,140,120.0,"Intuit - Data
", CA,0,37,0,0,0
$152K-$172K (Glassdoor est.),"Faire is using machine learning to change wholesale and help local retailers compete with Amazon and big box stores. Our experienced data scientists and machine learning engineers are tackling recommendations, ranking, search, logistics, underwriting, and more - all with the goal of helping local retail thrive.

Job Description

The Data Science team owns a wide variety of algorithms and models that power the marketplace. We care about building machine learning models that help our customers thrive. The data science team helps answer questions like; How do we underwrite retailers with thin files? How do we optimally assign term limits to Faire retailers? How to minimize the risk of defaults while maximizing the share of wallet growth driven by net terms? What data sources should we invest in to improve the performance of our credit models?

We're looking for someone who's comfortable working on the cutting edge of machine learning research. You're happy working autonomously and delivering results without micromanagement. You wake up ready to take a problem end-to-end, dive into the guts of our information-rich databases, and produce actionable insights. You can't wait to push the boundaries and discover the next big thing, then share it with your peers. You are, or will be, world-class in credit risk and help lead the wider data community. Faire will soon be known as a top destination for data scientists and machine learning, and you will help take us there!

You're excited about this role because
You'll be able to work on cutting edge credit underwriting problems combining a wide variety of data about our retailers, makers and products
You are passionate about solving problems in the FinTech space with innovative machine learning techniques and using alternate data sources for risk management
You want to use machine learning to help local retailers and independent makers succeed
You want to be a foundational member of a fast-growing company
Qualifications
3+ years of industry experience in developing, testing, and validating credit risk models in the financial services industry
Experience applying with either boosted trees models, decision trees, or other models to solve credit underwriting problems
Strong skills in statistics, probability, and/or machine learning
A track record of solving problems using data science. The tooling/language isn't important. (e.g., numpy, pandas, scikit-learn, R, etc.)
Experience with relational databases and SQL
Relentless resourcefulness and the ability to thrive in a startup -- you're willing to do what needs to be done for the success of your team
The ability to self-regulate and get stuff done with minimal direct supervision
Strong communication skills and the ability to work with others in a closely collaborative team environment.
Nice to have:
MSc or PhD in any mathematical or statistical subject, e.g.: mathematics, statistics, computer science, astrophysics, neuroscience, operations research, economics, any of the physical sciences
Experience with capital markets reporting and credit line management is a plus
What We Offer:
We're growing fast. You will get in on the ground floor of something that's going to be special.
We're funded by the best VCs in the world.
Our founding team is experienced and led the development of one of the top 25 apps in the US App Store (Square Cash).
Great technology stack. It's fun to work with the best tools and the latest software.
The business makes sense. It's straightforward, provides clear value to both retailers and makers. You get to help change an entire industry for the better.
It's beautiful. Work on something that's well-designed, following the footsteps of Apple and Square.
About Faire

Faire is an innovative online marketplace that uses machine learning to match local retailers with the makers of products that uniquely fit their stores. We are using the power of technology to connect makers and boutiques from all over the world, building a thriving community of over 50,000 small business owners.

Our mission is to empower entrepreneurs to chase their dreams. We believe entrepreneurship is a calling. It's a way of life that offers people a level of autonomy and fulfillment that's become difficult to find elsewhere in our economy. Most of our customers have left behind jobs they hated to take a chance on themselves. We want to make sure their boldness and self-belief gets rewarded.

This mission also extends to the way we are building the company. Every member of our team is an owner of the business and taking part in the founding process.

Faire is being built for entrepreneurs, by entrepreneurs.",4.5,"Faire
4.5","San Francisco, CA","San Francisco, CA",201 to 500 employees,2016,Company - Private,Wholesale,Business Services,Unknown / Non-Applicable,Shopify,0,0,152,172,162.0,"Faire
", CA,1,4,0,0,0
$120K-$146K (Glassdoor est.),"Location: San Francisco, CA- United States
Job ID: 20WD39639

Position Overview
Are you excited about telling stories by analyzing and making sense of data? Are you interested in producing actionable insights from large datasets that can power business decisions? Do you want to create impact by building data products that power a digital enterprise?

Our team is looking for a driven individual that is both technically able and business-savvy. Someone that can discover meaningful patterns in large datasets. Someone that is not afraid of asking questions, challenging assumptions and dealing with complexity in trying to answer broad business questions.

This Data Scientist position will help Autodesk’s IT organization, Digital Enterprise Services (DES), uncover insights from experience and technology operations data. In this role, you will build sustainable data products that help management take business decisions on an ongoing basis. The position also requires collaboration with service managers, engineers and planners to inform strategies that enable them to take high-quality decisions and provide better services.

The ideal candidate is someone who isn’t afraid of technical complexity and dedicatedly looks for ways to leverage the latest and greatest advancements in the field of data science to help DES improve its operations and deliver a world-class experience to Autodesk employees.

Responsibilities
Perform analysis on large datasets and produce qualitative visualizations based on reporting requirements
Develop analytical solutions and dashboards that integrate data from a wide variety of sources such as relational databases, AWS, data virtualization tools
Find correlations between data attributes and ways they affect each other by employing statistical analysis with Python e.g. what factors during incident resolution influence customer satisfaction scores and how
Build statistical models (predictive and descriptive) for customer demand, satisfaction, sentiment and segmentation
Build automated reporting models that can test for hypotheses and answer business questions
Understand technology operations data from many different sources in detail to create these models
Optimize workflows and scripts on data lake for data cleaning, processing and transformation
Collaborate with the engineering team to create, maintain and enhance data pipelines which gather data from various systems or sources
Partner closely with service managers and engineers to understand the underlying data and help them make business decisions through insights and data products
Minimum Qualifications
MS, or PhD in Computer Science, Business Analytics, Data Science, Management of Information Systems, Engineering or another quantitative discipline
Proficiency with data analysis using Python and experience with open source data science toolkits (Pandas, SciPy, SciKitLearn, NLTK)
Familiarity with various statistical and machine learning techniques including classification, regression, dimension reduction, regularization, clustering and various multivariate methods
Familiarity with relational data modeling and SQL
Readiness to learn and pick up new technologies such as AWS Sagemaker to build, train and deploy your models
Excellent oral and visual communication skills
Prior experience (3-4 years) working in a global, high technology company
Preferred Qualifications
Adaptable and comfortable with complexity and uncertainty
Be self-motivated, creative and collaborative
Prior experience implementing and deploying data science models or data products in Production
Experience working in an Agile/Scrum environment
Experience working in an AWS environment and leveraging its offerings such as EC2, S3, Lambda, Glue, Athena, Sagemaker etc.",4.0,"Autodesk
4.0","San Francisco, CA","San Rafael, CA",5001 to 10000 employees,1982,Company - Public,Computer Hardware & Software,Information Technology,$2 to $5 billion (USD),-1,0,0,120,146,133.0,"Autodesk
", CA,0,38,1,0,0
$67K-$89K (Glassdoor est.),"Come join the true partner of global healthcare companies who builds transformational solutions by challenging the boundaries of commercialization strategies to improve the lives of patients.


Natural Language Processing (NLP) Engineer

About us:

Amplity Insights is at the forefront of data insights in the healthcare industry. Utilizing a database of unstructured medical data and a toolset that enables us to extract valuable insights, we provide datasets and analysis on any number of topics of interest, including patient and physician reasoning, treatment decisions, or trends in the healthcare industry.

Job Summary:

The candidate will work as part of the Insights Dev Ops team to deliver existing data products to clients, help develop new capabilities around Natural Language Processing (NLP) extraction and Machine Learning (ML), and develop and deploy processes related to data analysis, data quality, and data delivery.

Job Functions:
Work with business stakeholders to translate business goals into analytics use cases; propose and implement appropriate data science approaches to deliver insights and/or models using NLP
Text mine a database of 50M+ unstructured text records using a graphical NLP platform and its APIs to generate datasets to be used for subsequent analytical processes.
Develop and apply end-to-end NLP methodologies for sentiment analysis, text classification, topic modeling
Build a deep understanding of the Company’s products, services, data, and customers to facilitate the development of customized data solutions for our clients and stakeholders.
Dives into machine learning engineering and researching topics including ML algorithms, feature engineering, analysis, modeling, and production deployment.
Develops training and cross-validation data sets for machine learning algorithms.
Identifies new opportunities for applying ML technology to improve business workflows and processes.
Requirements:
Demonstrated background in NLP and machine learning using ‘noisy’ and unstructured text data
Degree in computer science, data science, computational linguistics, information retrieval, statistics, applied math, or other quantitative field is preferred
Has demonstrated experience working with large data sets in Hadoop and traditional SQL databases
Experience with implementation/deployment of NLP pipeline from end to end
Strong programming skills in Python, SQL, R
Solid background in statistical learning techniques for NLP (HMMs, CRFs, SVMs, LDA, LSI, MRFs)
Must have experience in: document/text classification, sentiment analysis, topic modelling, information extraction, ontology. Strong plus for: Natural Language Understanding (NLG), entity/relation extraction, summarization, semantics, question answering, knowledge graph, building domain-specific ontologies
Experience with modern deep learning approaches to NLP: word/paragraph embeddings, structured prediction, sentiment analysis, disambiguation
Strong understanding of text pre-processing and normalization techniques, such as tokenization, POS tagging and parsing and how they work at a low level.
Knowledge of python-based or other visualization tools (ggplot, matplotlab, seaborn, D3.js, Tableau, etc.)
Self-motivated, ability to work independently with a ‘sense of urgency’ in order to deliver high-quality/error-free output while meeting critical deadlines in ambiguous situations.
Experience working with business stakeholders to translate business goals into analytics solutions;
Ability to discuss modeling approaches, alternatives, trade-offs, and understanding of development practices (testing, code design, complexity, and code optimization)
Ability to quickly prototype ideas and solve complex problems by adapting creative approaches.
Detail oriented with strong investigative and problem-solving skills
Strong communication skills, both verbal and written
Ability to proactively engage in a teamwork culture
Desired Skills & Experience:
Advanced degree in Data Science with a focus in NLP/computation linguistics
Experience using NLP platforms and other open-source NLP toolkits like NLTK, CoreNLP, OpenNLP, gensim, LingPipe, Mallet, etc.
Experience with pre-built machine learning platforms such as Amazon Comprehend on AWS
2+ years’ NLP experience
2+ years’ experience building and managing data pipelines.
Partnership. Amplified.

ABOUT US

Amplity provides a comprehensive array of multichannel message delivery solutions to the life sciences industry. From in field to inside and from promotional to clinical, Amplity centers-of-excellence include field sales and service, live video detailing, inside credentialed sales specialists, inside sales and service, clinical health educators, and medical science liaisons. A wide range of vital support solutions-each of which serves all of the company's message delivery channels-includes recruiting, training, performance management, operations, data/analytics, and compliance. Amplity Health provides the human touch to precision multichannel messaging delivered at the right time and through the right channels to achieve maximum impact.

Partnership. Amplified.

OUR CULTURE

When you join Amplity Health, you have the opportunity to work with and learn from leaders in the health care industry. Our commitment to a team-oriented culture and value-based leadership model provides an environment where our employees can work to their full potential. Opportunities with Amplity offer competitive compensation and dependent on the opportunity could include a comprehensive benefits package and 401K benefits. Join the Amplity team to grow with the nation's leader in healthcare.
One of our goals is to continuously drive innovation through our people by creating an open, respectful, inclusive and trustworthy work environment. We encourage and support equal employment opportunities for all associates and applicants for employment without regard to race, color, creed, religion, age, sex, sexual orientation, gender, gender identity, gender expression, national origin, ancestry, citizenship status, marital status, medical condition as defined by applicable state law, genetic information, disability, military service and veteran status, pregnancy, childbirth and related medical conditions, or any other characteristic protected by applicable federal, state, or local laws and ordinances. Employment decisions are evaluated on the basis of an individual's skills, knowledge, abilities, job performance and other qualifications. We do not condone or tolerate an atmosphere of intimidation or harassment.

To learn more about us, visit our website at amplity.com or our social media pages.

OUR DIVERSITY POLICY

We encourage and support equal employment opportunities for all associates and applicants for employment without regard to sex, race, color, religion, national origin, age, disability, marital status, sexual orientation or veteran status. Employment decisions are evaluated on the basis of an individual's skills, knowledge, abilities, job performance and other qualifications. In addition, Amplity Health maintains policies and procedures designed to comply with applicable federal, state and local laws governing non-discrimination in employment in every location in which Amplity Health has facilities.",3.7,"Amplity Health
3.7","Yardley, PA","Yardley, PA",1001 to 5000 employees,2019,Company - Private,Biotech & Pharmaceuticals,Biotech & Pharmaceuticals,Unknown / Non-Applicable,-1,0,0,67,89,78.0,"Amplity Health
", PA,1,1,1,0,0
$78K-$90K (Glassdoor est.),"Overview


The Data Engineer participates in the design and build of modern data products that comprise of raw data stores (data lakes) and cleansed data repositories, populated by batch or streaming data pipelines. The Data Engineer works with a team to create a robust, sustainable and flexible design and leads the technical delivery using Agile delivery frameworks like Scrum or Kanban.

Responsibilities
Developing and managing data processes to ensure that data is available and usable
Creation and automation of data pipelines and platforms
Managing and monitoring data quality via automated testing frameworks (Data Driven Testing, TDD, etc.)
Working closely with Architects, Data Scientists, and DevOps to design, build, test, deliver, and maintain sustainable and highly scalable data solutions
Researching data acquisition and evaluating suitability
Integration of data management solutions into client environment
Actively managing risks to data and ensuring there is a data recovery plan
Building data repositories such as: data warehouses, data lakes, and operational data stores, etc.
Qualifications
3+ years relevant professional work experience.
Experience and expertise in the following:
Creating robust and extensible data pipelines for production systems
Use of cloud platforms, preferably AWS
Creating secure, performant, and well-modeled data stores
Common analytical platform architectural patterns (Star Schema, data integration patterns, ABAC, data quality frameworks etc.)
Data lake design patterns and technology options (schema on read, metadata capture, search framework)
Use of scripting languages, preferably Python
Familiarity with NoSQL databases
Source code version control management using git
Project experience using the Scrum or Kanban framework.
Professionalism; to include written and oral communication – the ability to communicate collaboratively in front of a whiteboard. An ability to understand your audience and adjust your communication style to fit
Aptitude and desire for learning new technologies.
Technically savvy, entrepreneurial spirit who thrives in environments that reward self-initiative and resourcefulness.
About Excella


Excella is a leading provider of Agile software development and data and analytics solutions to clients in the federal, commercial and non-profit sectors. We believe that great work leads to great things –- our experts measure success by the positive impact we make on our clients, community, and colleagues. We are growing fast and need passionate, innovative people who love working with technology and are ready to make an impact.

Here's what you can expect from us:
You'll work with great people who love what they do: our team includes published authors, certified trainers, and internationally renowned speakers.
We have a ""bring your own device"" workplace and will share the cost of a new computer of your choice -- Mac or PC. It's up to you.
We'll invest in your career by providing 3 days of paid professional development every year, including travel and registration fees to attend classes and conferences, in addition to tuition assistance for degrees and certifications.
Starting day one, every employee is bonus eligible and receives 15 days of paid vacation, 6 federal holidays, and 4 floating holidays.
You can bike, drive, or metro to work -- our commute reimbursement plan has you covered.
You'll have fun! We hold monthly social events all year long, including a summer event for you and your family.
Excella is an equal opportunity/affirmative action employer. All qualified applicants will receive consideration for employment without regard to sex, gender identity, sexual orientation, race, color, religion, national origin, disability, protected veteran status, age, or any other characteristic protected by law.",4.0,"Excella Consulting
4.0","Arlington, VA","Arlington, VA",201 to 500 employees,2002,Company - Private,Consulting,Business Services,$50 to $100 million (USD),-1,0,0,78,90,84.0,"Excella Consulting
", VA,1,18,1,0,0
