Salary Estimate,Job Description,Rating,Company Name,Location,Headquarters,Size,Founded,Type of ownership,Industry,Sector,Revenue,Competitors,hourly,employer_Provided,min_salary,max_salary,avg_salary,company_txt,job_state,some_state,age,python_yn,R_yn,Spark
$53K-$72K (Glassdoor est.),"Position Overview:

The Sr. Data Analyst plays a key role on the Data Informatics/Data Warehouse team to define requirements, understand business needs and workflows, and work with various business units to provide Data Analysis, Database Backend Applications Maintenance and Development, Reporting and BI solutions that are needed by the organization.

Essential Functions:

· Collaborate with stakeholders to understand, define, and document business questions needs (metrics, dimensions, charts, and dashboards).

· Create and collect feedback on data visualizations (reports/dashboards) to bring insight and answers to business problems/KPIs.

· Serve as primary report writer for all business units.

· Responsible for recurring monthly, weekly, daily, and ad hoc reporting needs.

· Collect and interpret data from multiple sources, both internal& external.

· Develop, create, analyze and distribute management reports as required.

Position Requirements:

· Education: Bachelor’s degree in business, computer science, statistics, mathematics or related field.

· License/Certification: N/A

· Relevant Work Experience: Minimum of 4-5 years’ experience as a reporting or data analyst, reports writer or similar role with a strong understanding of SQL and data modeling.

· 4+ years’ experience with ETL, Data Modeling, Data Warehousing and SSAS preferred

· 4+ years’ experience with contemporary data visualization technology (Power BI, Tableau, Qlik Sense, etc.) preferred

· 4+ years’ experience with Excel preferred

· Healthcare experience is preferred

· Skills:

· Extract data and create reports using tools such as SQL, SSIS, SSRS, Excel, or Access

· Ability to tell stories using data& visualizations

· Plan, design and build ETL solutions for the Data Warehouse

· Knowledge of modern trends, tools and approaches to collection and visualization",3.7,"Community Behavioral Health
3.7","Philadelphia, PA","Phila, PA",201 to 500 employees,1994,Company - Private,Health Care Services & Hospitals,Health Care,$500 million to $1 billion (USD),-1,0,0,53,72,62.5,"Community Behavioral Health
", PA,0,26,0,0,0
$102K-$135K (Glassdoor est.),"Integral Ad Science (IAS) is a global technology and data company that builds verification, optimization, and analytics solutions for the advertising industry and we're looking for an Associate Big Data Engineer (entry-level) to join our Data Engineering team. If you are excited by technology that has the power to handle hundreds of thousands of transactions per second; collect tens of billions of events each day; and evaluate thousands of data-points in real-time all while responding in just a few milliseconds, then IAS is the place for you!

As an Associate Data Engineer you will build and expand upon the testing framework and testing infrastructure of IAS' core ad verification, analytics and anti ad fraud software products.

The ideal candidate is naturally curious, dedicated, detail-oriented with a strong desire to work with awesome people in a highly collaborative environment. You should be able to not take yourself too seriously as well.

What you'll do:
Extract, transform, and analyze large volumes of structured and unstructured data
Implement data processing solutions using Big data stack including but not limited to Hadoop, Spark, Java Map Reduce, Pig and Hive
Write SQL queries and other types of data requests in the context of massive data sets
Build data pipelines and data stores optimized for data science needs
Implement systems for large-scale data analysis and machine learning.
Identify and implement automated tests for software components. Deploy and maintain data processing systems in production
Partner with engineering teams on deployments of data science driven solutions
Who you are and what you have:
Technology enthusiast eager to learn and use new technologies
Strong communication skills
Team player
0-1 years professional experience programming in object oriented languages such as Java, Scala or Python
Basic understanding of algorithms and data structures
What puts you over the top:
Bachelors in Computer Engineering, Computer Science, Electronics Engineering, or related fields
Basic understanding of databases such as Oracle, Postgres, SQL Server, Snowflake or MySql
Basic understanding of scripting using Perl or Shell
Basic understanding of AWS Analytics technologies
About Integral Ad Science

Integral Ad Science (IAS) is the global market leader in digital ad verification, offering technologies that drive high-quality advertising media. IAS equips advertisers and publishers with both the insight and technology to protect their advertising investments from fraud and unsafe environments as well as to capture consumer attention, and drive business outcomes. Founded in 2009, IAS is headquartered in New York with global operations in 18 offices across 13 countries. IAS is part of the Vista Equity Partners portfolio of software companies. For more on how IAS is powering great impressions for top publishers and advertisers around the world, visit integralads.com.

Equal Opportunity Employer:

IAS is an equal opportunity employer, committed to our diversity and inclusiveness. We will consider all qualified applicants without regard to race, color, nationality, gender, gender identity or expression, sexual orientation, religion, disability or age. We strongly encourage women, people of color, members of the LGBTQIA community, people with disabilities and veterans to apply.

California Applicant Pre-Collection Notice:

We collect personal information (PI) from you in connection with your application for employment or engagement with IAS, including the following categories of PI: identifiers, personal records, commercial information, professional or employment or engagement information, non-public education records, and inferences drawn from your PI. We collect your PI for our purposes, including performing services and operations related to your potential employment or engagement. For additional details or if you have questions, contact us at compliance@integralads.com.

To learn more about us, please visit http://integralads.com/ and https://muse.cm/2t8eGlN

Attention agency/3rd party recruiters: IAS does not accept any unsolicited resumes or candidate profiles. If you are interested in becoming an IAS recruiting partner, please send an email introducing your company to recruitingagencies@integralads.com. We will get back to you if there's interest in a partnership.",3.6,"Integral Ad Science
3.6","Chicago, IL","New York, NY",501 to 1000 employees,2009,Company - Private,Internet,Information Technology,$100 to $500 million (USD),-1,0,0,102,135,118.5,"Integral Ad Science
", IL,0,11,1,0,1
$59K-$102K (Glassdoor est.),"Data Scientist
Location: Washington, DC
Education Required: Bachelor’s degree required, preferably in math, engineering, business, or the sciences.
Skills Required:
Bachelor’s Degree in relevant field, e.g., math, data analysis, database, computer science, Artificial Intelligence (AI); three years’ experience credit for Master’s degree; five years’ experience credit for a Ph.D
Applicant should be proficient in the use of Power BI, Tableau, Python, MATLAB, Microsoft Word, PowerPoint, Excel, and working knowledge of MS Access, LMS, SAS, data visualization tools, and have a strong algorithmic aptitude
Excellent verbal and written communication skills, and quantitative analytical skills are required
Applicant must be able to work in a team environment
U.S. citizenship and ability to obtain a DoD Secret Clearance required
Responsibilities: The applicant will be responsible for formulating analytical solutions to complex data problems; creating data analytic models to improve data metrics; analyzing customer behavior and trends; delivering insights to stakeholders, as well as designing and crafting reports, dashboards, models, and algorithms to make data insights actionable; selecting features, building and optimizing classifiers using machine learning techniques; data mining using state-of-the-art methods, extending organization’s data with third party sources of information when needed; enhancing data collection procedures to include information that is relevant for building analytic systems; processing, cleansing, and verifying the integrity of data used for analysis; doing ad-hoc analysis and presenting results in a clear manner; and creating automated anomaly detection systems and constant tracking of its performance.
Benefits:
We offer competitive salaries commensurate with education and experience. We have an excellent benefits package that includes:
Comprehensive health, dental, life, long and short term disability insurance
100% Company funded Retirement Plans
Generous vacation, holiday and sick pay plans
Tuition assistance

Benefits are provided to employees regularly working a minimum of 30 hours per week.

Tecolote Research is a private, employee-owned corporation where people are our primary resource. Our investments in technology and training give our employees the tools to ensure our clients are provided the solutions they need, and our very high employee retention rate and stable workforce is an added value to our customers. Apply now to connect with a company that invests in you.",3.8,"Tecolote Research
3.8","Washington, DC","Goleta, CA",501 to 1000 employees,1973,Company - Private,Aerospace & Defense,Aerospace & Defense,$50 to $100 million (USD),-1,0,0,59,102,80.5,"Tecolote Research
", DC,0,47,1,0,0
$112K-$145K (Glassdoor est.),"The position

Were seeking an entrepreneurial and innovative Sr. Data Scientist to join our Analytics team! Evolve has been diligently working on creating a pricing algorithm built to adjust nightly rates based on live market behavior. This tool will scale with our business as we grow to be one of the largest in the industry while ensuring maximum profitability for each of our individual owners.

Our dream applicant has built high performing pricing models, has experience utilizing machine learning to solve complex data problems, and is hungry to make a difference. This is your opportunity to create an industry-leading pricing strategy and be a part of the spotlight as you pioneer automated intellectual pricing in the Vacation Rental Management industry. Were a tight-knit team of Data Scientists and BI professionals that learn together and are constantly thinking about how machine learning, analytics, and visualization can make an impact on our business.

What youll get to do
In collaboration with revenue management and engineering teams, own the development, deployment and optimization of a vacation rental pricing model
Utilize machine learning, statistical methods, and experimental design techniques to create a highly performant algorithm
Maintain model explainability and present new models in a way that builds trust and understanding across stakeholders
Monitor model performance and identify opportunities for improvement
Incorporate a test and learn mentality into model development
Implement creative solutions to price properties in smaller markets
A little about you
Bachelors degree in Computer Science, Statistics, or related quantitative field, Masters or PhD preferred
2+ years experience price forecasting for heterogeneous inventory dealing with seasonal and market shifts
Proven track record of your deployed models making a business impact and getting better over time.
Programming experience with Python and SQL, ideally in a full-stack machine learning setting
Experience with pricing in the travel industry a plus
Ability to work in a collaborative environment with a variety of stakeholders
A little about us

Evolve makes vacation rental easy for everyone. Our fresh approach to vacation rental management offers homeowners a better way to generate rental income and provides travelers with the industry's best booking experience.

Thanks to a strong work ethic and an unapologetic passion for hospitality, we now support over 10,000 properties in over 500 markets across North America. We enjoy earning each guest and owner's business - all while having some fun along the way.

Values mean more to Evolve than just bullets on a page. They drive our daily decisions and impact how we work as a hospitality company. Which value sounds the most like you?
Earn It
Build Loyalty One Interaction at a Time
Communicate Often, Honestly & Directly
Embrace Change
Stay Hungry & Humble
Care
Be Efficient
Take Risks
Learn Every Day
Have Some Fun Along the Way
Evolve is an equal opportunity employer. We believe that a diverse work environment is a successful work environment so all qualified candidates will be considered for employment without regard to race, color, religion, gender, gender identity or expression, sexual orientation, national origin, genetics, disability, age, or veteran status.

Powered by JazzHR",3.7,"Evolve Vacation Rental
3.7","Denver, CO","Denver, CO",201 to 500 employees,2011,Company - Private,Travel Agencies,Travel & Tourism,Unknown / Non-Applicable,-1,0,0,112,145,128.5,"Evolve Vacation Rental
", CO,1,9,1,0,0
$37K-$67K (Glassdoor est.),"Are you interested in a career opportunity with a growing software company? P2 Energy Solutions is dedicated to providing a positive culture where the ability to learn, collaborate, and make a difference is rewarded. We have a fast-paced, innovative culture where employees are empowered to provide a superior experience for internal and external customers.
Upstream oil and gas professionals who are focused on solving tough challenges rely on P2 software, data and analytics solutions to optimize their business performance. We are currently developing our solutions on mobile and in the cloud! More than 1,600 companies from around the world use P2 solutions every day to manage their land assets, measure and process financial information, optimize production, and manage their reserves. With more than 80 years of experience in data and 30 years in software, P2 has offices around the world, and employs approximately 600 people.

Interface with customers and conversion team to identify, develop, and implement transitioning of data from product to product. Assist with application development estimating, planning, and progress tracking. Data conversions work around the idea of taking source data from any format and projecting/inserting said data into the databases iLandMan uses. Although we’re actually using business logic to perform all actions, it’s still crucial to understand how bridge/association tables work as well as the fundamentals of database design and structure. Then, one must apply these concepts along with a working knowledge of how land data works in the oil and gas industry.
Job Requirements:
Create/Write scripts to transfer data from format to format
Comfort working in Microsoft based realms: operating systems and platforms (.NET), application servers (IIS), architecture, implementation patterns.
Experience with SQL Server, strong excel and database skills. Ability to clearly communicate technical ideas, whether to other technical peers ornon-technical project managers or customers.
Recommended Qualifications:
5-7 Years relevant Data Experience
Bachelors Degree, Computer Science or Engineering
Experience with web-based technologies: HTML, Jquery, Javscript, Web-Sockets. Knowledge of IT security concepts such as Auth 0, SSL/TLS, tokens.
Strong background of computer science and software development and scripting.
A passion for problem solving. Source data can and will be in all possible formats.
Must be able to envision how incorporating all data elements will work and fail in order to progress the project to the best possible solution.
An understanding of land terminology and how a system may be built around the industries standards.
An understanding of the difference between Lease based and Tract based systems. Since iLandMan is
Tract based we must strive to represent a Tract as a single instance. This helps to understand how we handle Contract Lessee Participation on a Depth basis.

Always be learning.
When in doubt, talk it out.
Show up and follow up.
Create positive energy.
Think beyond…
Please note: Assessment testing may be required for this position.
We offer a casual work environment, comprehensive benefits plan, generous PTO, and a competitive compensation structure. We have a positive culture designed around the philosophy of mutual respect and the challenge of contributing to the continued success of our organization. P2 is dedicated to individual and corporate growth opportunities, and we would love to talk to you further!
P2 Energy Solutions and its affiliated companies is an Equal Employment Opportunity employer. We also participate in the E-Verify program, a service of DHS and SSA.",3.7,"P2 Energy Solutions
3.7","Lafayette, LA","Denver, CO",501 to 1000 employees,-1,Company - Private,Computer Hardware & Software,Information Technology,Unknown / Non-Applicable,-1,0,0,37,67,52.0,"P2 Energy Solutions
", LA,0,-1,0,0,0
$85K-$95K (Glassdoor est.),"Fareportal is seeking a Marketing Data Analyst t to join our Marketing Team.

At Fareportal, we create technology that is driving innovation in the travel industry - one of the world's fastest-growing sectors. Our employees are the core of our organization and together we're revolutionizing the way people book travel.

Our portfolio of brands including CheapOair and OneTravel receive over 100 million visitors annually and drive over $4 billion in annual revenue.

We are seeking for a Marketing Data Analyst May 2020 Under grad will be responsible for providing a data driven approach to key long-term investment decisions as well as providing insight to sustain and accelerate the growth of the business. The role will leverage internal data sources, market data and industry knowledge & expertise to support strategic decision making.

Pre-requisites for the role include a technical/analytical skill set, a strong business acumen and a curious mind-set capable of thinking outside the box and questioning the status quo. The role requires a high degree of flexibility and the ability to proactively provide insight and recommendations throughout the organization.

Responsibilities:
Understand the business drivers, spot new growth opportunities and make recommendations to drive the business to a higher level of profitability.
Work on new investment ideas, building a business case to support the decision. Assess costs and forecast the revenue streams.
Understand the impact of retention and acquisition marketing on the business. Calculate the Return of Investment, provide actionable insights and work with the commercial and marketing team to set the right strategy.
Use a scalable approach when facing problems and build tools to automate and improve manual processes.
Requirements:
May 2020 under grad BS/BA College Degree in an analytical discipline (i.e. Engineering, Statistical Science, Mathematics, Actuarial Studies, Economics, Computer Science, etc.)
Experience in working with large complex datasets to derive insight
Excellent knowledge of SQL, Excel
Comfortable using graphs and other illustrative tools to present large volume of data.
Pro-active problem solver attitude with flexibility to work across different units.
Strong work ethic complemented by a positive, can-do attitude.
Understanding of the online business, e-commerce.
Inclined to learn data analysis tools and languages such as Knime, R, SAS etc.
Professional interest in Online Travel/e-commerce/tech industry",3.7,"Fareportal
3.7","New York, NY","New York, NY",1001 to 5000 employees,2002,Company - Private,Travel Agencies,Travel & Tourism,$2 to $5 billion (USD),"Expedia Group, Orbitz Worldwide, Priceline.com",0,0,85,95,90.0,"Fareportal
", NY,1,18,0,0,0
$46K-$79K (Glassdoor est.),"Company Description

JDRF is the leading global organization focused on type 1 diabetes (T1D) research. JDRF’s goal is to progressively remove the impact of T1D from people’s lives until we achieve a world without T1D. JDRF collaborates with a wide spectrum of partners and is the only organization with the scientific resources, policy influence and a working plan to bring life-changing therapies from the lab to the community. As the largest charitable supporter of T1D research, JDRF has invested nearly $2B in research over the past 45 years and is sponsoring scientific research in 17 countries worldwide.

Job Description

JDRF is growing rapidly and the demand for analytics is increasing exponentially along with our recent growth. We’re seeking a Data Analyst on our Data Science team who will work closely with our Business Development team to extract valuable, actionable insights for our clients. The work that the Data Analyst does will help both internal and external teams better understand JDRF’s performance and identify strategic opportunities for improvement.

Responsibilities:
Identify data-driven insights and recommendations that help our clients improve their existing operational processes and understanding of their donor populations.
Present and clearly communicate data findings and underlying methodology to internal teams and external clients through dashboards and visualizations.
Help develop and standardize methods and processes with which the Data Science team can scale and enable internal teams to gain access to data insights.
Understand the mechanics of JDRF’s platform and our data models.
Perform ad hoc analysis of our client facing systemic issues and answer questions that lead to a solution.
Act as a client-facing subject matter expert on JDRF data and the insights that we can gather from it.
Build dashboards that enable data democratization and empower teammates to monitor key metrics
Have a direct and profound effect on a data-driven organization.
Qualifications
3+ years’ experience in an analytical role
Strong organizational, time management, and presentation skills
Demonstrates a passion for breaking down and understanding complex systems
Ability to effectively communicate across business stakeholders
Degree in a quantitative field and 3+ years of experience in data analytics
Strong SQL skills and knowledge of relational databases
Experience in Python or other scripting languages
Proficiency with business intelligence tools
Strong knowledge of ETL processes
Additional Information

All your information will be kept confidential according to EEO guidelines.",2.8,"JDRF International
2.8","New York, NY","New York, NY",501 to 1000 employees,1970,Nonprofit Organization,Health Fundraising Organizations,Non-Profit,$100 to $500 million (USD),"American Diabetes Association, March of Dimes, American Heart Association",0,0,46,79,62.5,"JDRF International
", NY,1,50,1,0,0
