Salary Estimate,Job Description,Rating,Company Name,Location,Headquarters,Size,Founded,Type of ownership,Industry,Sector,Revenue,Competitors,hourly,employer_Provided,min_salary,max_salary,avg_salary,company_txt,job_state,some_state,age,python_yn,R_yn,Spark
$115K-$133K (Glassdoor est.),"Auto req ID: 207072BR
Job Description


Bring your passion and talent in Data Science to our stage and continue to share our future and deliver innovative products to delight our consumers.

PepsiCo Global R&D’s Data Science and Analytics team focuses on the autonomous or semi-autonomous examination of data and content to discover deep insights, make predictions, and/or provide recommendations. We use various techniques and tools that are beyond traditional business intelligence ones. Our major techniques and expertise include, ML/AI for predictive modeling and cognitive computing (vision, speech, language analytics, etc.), and robotic process automation (RPA). We support research and development of PepsiCo’s diverse portfolio of beverages and foods to make a business impact on market success.

Rewarding opportunity for personal and professional growth. You will have a unique opportunity to propel the use of Data Science in an R&D setting to build and sustain our innovation pipeline.
As a data scientist, you will proactively obtain data/information from various sources and analyze them to provide a better understanding of R&D Innovation performance. You will build AI/ML tools that automate certain processes within Global R&D. Your duties typically include creating various AI/ML-based tools or processes within Global R&D, such as recommendation engines or predictive models. Ability to perform statistical analyses is also within scope of the role.

Critical Competencies:
Execute operating plan projects through statistical methods and advanced data modeling techniques that provide business impact and value
Partner with R&D Categories to identify new advanced analytic tools as needed
Select features, build and optimize classifiers using machine learning techniques
Data mining using state-of-the-art methods
Extend company’s data with third party sources of information when needed
Enhance data collection procedures to include information that is relevant to building analytic systems
Process, cleanse, and verify the integrity of data used for analysis
Communicate and presenting results in a clear manner
Qualifications/Requirements
Execute operating plan projects through statistical methods and advanced data modeling techniques that provide business impacts and value
Partner with R&D Categories to identify new advanced analytic tools as needed
Select features, build and optimize classifiers using machine learning techniques
Data mining using state-of-the-art methods
Extend company’s data with third party sources of information when needed
Enhance data collection procedures to include information that is relevant to building analytic systems
Process, cleanse, and verify the integrity of data used for analysis
Communicate and presenting results in a clear manner
Knowledge & Experience:

Minimum Master’s degree in Statistics, Mathematics, Computer Science or other quantitative Science/Engineering field.
Strong problem-solving skills with an emphasis on R&D innovation applications.
Experience using statistical computer languages (R, Python, SQL, etc.) to manipulate data and draw insights from large data sets.
Experience working with and creating data architectures.
Knowledge of advanced statistical techniques and concepts (regression, distributions, statistical tests and proper usage, etc.) and experience with their applications.
Knowledge of a variety of machine learning techniques (clustering, decision trees, artificial neural networks, etc.) and their real-world advantages/drawbacks.
Excellent written and verbal communication skills for coordinating across teams.
A drive to learn and master new technologies and techniques.
Relocation Eligible: Not Eligible for Relocation
Job Type: Regular

All qualified applicants will receive consideration for employment without regard to race, color, religion, sex, sexual orientation, gender identity, national origin, protected veteran status, or disability status.

PepsiCo is an Equal Opportunity Employer: Female / Minority / Disability / Protected Veteran / Sexual Orientation / Gender Identity

Our Company will consider for employment qualified applicants with criminal histories in a manner consistent with the requirements of the Fair Credit Reporting Act, and all other applicable laws, including but not limited to, San Francisco Police Code Sections 4901 - 4919, commonly referred to as the San Francisco Fair Chance Ordinance; and Chapter XVII, Article 9 of the Los Angeles Municipal Code, commonly referred to as the Fair Chance Initiative for Hiring Ordinance.

If you'd like more information about your EEO rights as an applicant under the law, please download the available EEO is the Law & EEO is the Law Supplement documents. View PepsiCo EEO Policy

Please view our Pay Transparency Statement",3.7,"PepsiCo
3.7","Purchase, NY","Purchase, NY",10000+ employees,1965,Company - Public,Food & Beverage Manufacturing,Manufacturing,$10+ billion (USD),"Unilever, Mondelēz International, Amazon",0,0,115,133,124.0,"PepsiCo
", NY,1,55,1,0,0
$216K-$234K (Glassdoor est.),"Secure our Nation, Ignite your Future

Summary

The successful candidate will possess a diverse range of data-focused skills and experience, both technical and analytical. They will have a strong desire and capability for problem solving, data analysis and troubleshooting, analytical thinking, and experimentation.

Duties, Tasks & Responsibilities
Working with large, complex, and disparate data sets
Designing and implementing innovative ways to analyze and exploit the Sponsors data holdings
Researching and reporting on a wide variety of Sponsor inquiries
Raising proactive inquiries to the Sponsor based on observations and proposed data analysis/exploitation
Solving difficult, non-routine problems by applying advanced analytical methodologies, and improving analytic methodologies
Developing custom searches
Communicating and coordinating with internal and external partners as needed
Required Experience, Skills, & Technologies
Thorough knowledge of appropriate analytic tools and methodologies in one or more of the following:
Applied mathematics (e.g. probability and statistics, formal modeling, computational social sciences)
Computer programming (e.g. programming languages, math/statistics packages, computer science, machine learning, scientific computing)
Ability to code or script in one or more general programming language
Experience with and theoretical understanding of algorithms for classification, regression, clustering, and anomaly detection
Knowledge of relational databases, including SQL and large-scale distributed systems (e.g. Hadoop)
Expertise with statistical data analysis (e.g. linear models, multivariate analysis, stochastic models, sampling methods)
Demonstrated effectiveness in collecting information and accurately representing/visualizing it to non-technical third parties
TS/SCI with Polygraph
Desired Experience, Skills & Technologies
Previous investigative experience, using a combination of technical and analytic skills
#LI-SS2

ManTech International Corporation, as well as its subsidiaries proactively fulfills its role as an equal opportunity employer. We do not discriminate against any employee or applicant for employment because of race, color, sex, religion, age, sexual orientation, gender identity and expression, national origin, marital status, physical or mental disability, status as a Disabled Veteran, Recently Separated Veteran, Active Duty Wartime or Campaign Badge Veteran, Armed Forces Services Medal, or any other characteristic protected by law.

If you require a reasonable accommodation to apply for a position with ManTech through its online applicant system, please contact ManTech's Corporate EEO Department at (703) 218-6000. ManTech is an affirmative action/equal opportunity employer - minorities, females, disabled and protected veterans are urged to apply. ManTech's utilization of any external recruitment or job placement agency is predicated upon its full compliance with our equal opportunity/affirmative action policies. ManTech does not accept resumes from unsolicited recruiting firms. We pay no fees for unsolicited services.

If you are a qualified individual with a disability or a disabled veteran, you have the right to request an accommodation if you are unable or limited in your ability to use or access http://www.mantech.com/careers/Pages/careers.aspx as a result of your disability. To request an accommodation please click careers@mantech.com and provide your name and contact information.",4.0,"ManTech
4.0","Chantilly, VA","Herndon, VA",5001 to 10000 employees,1968,Company - Public,Research & Development,Business Services,$1 to $2 billion (USD),-1,0,0,216,234,225.0,"ManTech
", VA,0,52,0,0,0
$56K-$75K (Glassdoor est.),"Xtend Healthcare, established in 2009, is seeking professionals to fulfill a specific need at one of our key clients of EY (Ernst & Young) within its Indianapolis healthcare advisory practice. These full-time positions offer a competitive salary and an attractive benefits package. The positions are long-term with no scheduled end date. Many current Xtend Healthcare employees have been contracted in similar roles at EY for multiple years -- some well over a decade.

EY is a globally recognized professional services firm and its Indianapolis healthcare advisory practice serves a variety of healthcare clients nationally. EY is looking to expand its existing team of Xtend Healthcare data analysts. Xtend Healthcare employees who act in these contracted roles have data analytics, informatics or business backgrounds. Some individuals do occasionally travel for work, but travel is not required by all. Candidates are expected to work daily in EY's downtown Indianapolis, Indiana office location.

EY offers our team members a highly inclusive, flexible work environment. Benefits also include the opportunity to develop and build upon deep technical skills, healthcare industry knowledge, and consulting skills through on-the-job training. The services provided include assisting their clients in complying with Medicare, Medicaid and other regulatory requirements, in addition to helping them receive the appropriate amount of reimbursement from these programs.

We are seeking qualified candidates for ourHealthcare Data Analystposition. This position will work with our client's proprietary tools to analyze large volumes of hospital data. The candidates must employ various technical data manipulation techniques to analyze large complex data sets, identify data patterns, data mine, etc. Through training, candidates must learn and apply relevant regulations to compile data sets. Candidates must be able to communicate results of the analysis to project managers.

JOB SUMMARY:

1. Analyze large volumes of hospital data.

2. Employ various techniques to analyze large complex data sets:
Data manipulation
Data mining
Identifying data patterns
3. Learn and apply relevant regulations to compile data sets.

4. Communicate results of analysis succinctly to project managers.

MINIMUM REQUIREMENTS:
Bachelor's Degree in Business, Informatics, Data Analytics, Finance, Accounting, or a related field.
2+ years experience in Business, Informatics, Data Analytics, Finance, Accounting, or a related field.
Intermediate level proficiency with Microsoft Excel required, with Microsoft Access, SQL or other database software experience recommended.
Successful reference check, background check and drug screening (required).
PREFERRED QUALIFICATIONS:
Experience with Medicare or Medicaid reimbursement, including cost reports, Medicare DSH and/or Medicare bad debts, is a significant advantage.
Intermediate level proficiency with Microsoft Excel (required) with Microsoft Access, SQL or other database software experience (recommended).
Acute attention to detail and strong analytical skills (required).
Strong written and verbal communication skills.
Ability to employ critical thinking skills and work independently while also working well within a team environment.
Receptiveness to differing views and ideas with the ability to apply industry-specific concepts.
Highly adaptable to changing circumstances and/or directives in day-to-day priorities.
Ability to perform well on frequent repetitive tasks while continually improving skills and competencies.
Willingness to travel occasionally (plus).
All offers of employment are contingent on standard background checks. Navient and certain of its affiliated companies are federal, state and/or local government contractors. Should this position support a Federal Government contract, now or in the future, the successful candidate will be subject to a background check conducted by the U.S. Government to determine eligibility and suitability for federal contract employment for public trust or sensitive positions. Positions that support state and/or local contracts also may require additional background checks to determine eligibility and suitability.

EOE Race/Ethnicity/Sex/Disability/Protected Vet/Sexual Orientation/Gender Identity. Navient Corporation and its subsidiaries are not sponsored by or agencies of the United States of America.

Navient is a drug free workplace.",3.4,"Navient
3.4","Indianapolis, IN","Wilmington, DE",5001 to 10000 employees,2014,Company - Public,Financial Transaction Processing,Finance,$2 to $5 billion (USD),-1,0,0,56,75,65.5,"Navient
", IN,0,6,0,0,0
$16K-$53K (Glassdoor est.),"Company Overview


Dematic is an intralogistics innovator that designs, builds and supports intelligent, automated solutions for manufacturing, warehouse and distribution environments for customers that are powering the future of commerce. With engineering centers, manufacturing facilities and service centers located in more than 25 countries, Dematic’s global network of 8,000 employees have helped achieve more than 6,000 worldwide customer installations for some of the world’s leading brands. Headquartered in Atlanta, Dematic is a member of KION Group, a global leader in industrial trucks, supply chain solutions and related services, and a leading provider of warehouse automation.

The Role


Overview:

The KION Group is a global leader in industrial trucks, related services, and supply chain solutions. Across more than 100 countries worldwide, the KION Group deisgns, builds, and supports logistics solutions that optimize material and information flow. KION is the second largest producer of forktrucks globally and the leading provider of warehouse automation.

KION’s Mobile Automation team is focused on developing robust and innovative autonomous vehicle solutions. Typical uses are for industrial or warehouse settings. AGV technology at KION is based on 35 years of real world application with over 8,000 AGVs being provided to customers so far.

About the Position:

We are seeking a highly talented Machine Learning Engineer to join our team. Your day-to-day activities will vary, but will be in the following areas:
Mapping and Localization: Development of advanced techniques for mapping, localization, and pose estimation of mobile robotic systems based on a variety of different sensors (camera, LIDAR, IMU, etc.).
Machine Learning: Developing and applying ML algorithms to the task of building / learning feature-extractors to enhance a vehicle’s spatial perception capabilities and robustness.
Software Development: Assisting in the design and implementation of developer and end-user tools that leverage ML.
What We Are Looking For


Experience/Skill Preferred:
Excellent communication skills
Strong background in machine vision and machine learning methods
Ability to implement new algorithms efficiently and rigorously
Strong quantitative ability
High level of experience with Python and C++ (Rust, Haskell, and/or Scala would also be great!)
Experience working with embedded systems with real-time constraints
Experience with software engineering tools (e.g. git, cmake, gdb, etc.)
Experience developing sotware a part of a team


Travel:
Travel – Up To 5% (including International)",3.8,"Dematic
3.8","Holland, MI","Atlanta, GA",5001 to 10000 employees,1819,Subsidiary or Business Segment,Electrical & Electronic Manufacturing,Manufacturing,Unknown / Non-Applicable,"Intelligrated, Daifuku, Viastore Systems",0,0,16,53,34.5,"Dematic
", MI,0,201,1,0,0
$130K-$170K (Glassdoor est.),"We are looking for a great data scientist for our Quickbooks Online (QBO) business. Quickbooks is used by over 5MM SMBs globally to run their businesses and we are the team responsible for using our data to answer the most critical questions facing the QBO Product Managers and Marketers. Everything from understanding the trends in our subscriber growth to shaping our product strategy through A/B testing and more happens within our team and we need top data scientists to help the business deliver the best possible product to our SMB customers. We are growing rapidly and need great people to support our analytical efforts in both Product and Marketing.

What does it take to thrive on our team? You need to be a top-notch problem solver and problem identifier. Its also a good idea to know the standard suite of analytical tools - SQL, R/Python, some sort of data visualization tool but were more interested in your ability to quickly learn new tools as the set of tools available is constantly evolving. Last, knowing that in most cases done is better than perfect is important - getting the current problem right to the sixth decimal place is almost always less impactful than getting to the next problem.

If this role sounds interesting go check out the product (https://quickbooks.intuit.com/) and if you find this exciting, then we look forward to hearing from you!",4.4,"Intuit - Data
4.4","Mountain View, CA","Mountain View, CA",5001 to 10000 employees,1983,Company - Public,Computer Hardware & Software,Information Technology,$2 to $5 billion (USD),"Square, PayPal, H&R Block",0,0,130,170,150.0,"Intuit - Data
", CA,1,37,1,0,0
$44K-$58K (Glassdoor est.),"Position Summary


The D&I Data Analyst will be responsible for the development of various management, Board of Directors (Board) and Federal Housing Finance Agency (FHFA) reports, including in-depth data analytics, quality reviews and control development, to support the development and execution of strategic objectives. The role will report to the Senior Director of the Office of Diversity and Inclusion and support the operational functions of the Office, including the Bank’s Diversity and Inclusion Leadership Committee, and supporting councils and employee resource groups.

Primary Success Factors


The D&I Data Analyst will demonstrate the ability to:
Assist in the preparation and submission of timely and accurate quarterly and annual reports to FHFA while collaborating with departments to gather and analyze information.
Review and provide recommendations regarding proper controls and procedures to ensure the integrity of the reports; identify opportunities for continuous system and process improvements and lead the development of supporting processes.
Perform in-depth data analytics, including quantitative, statistical and comparative analysis, to determine patterns and recognize trends; prepare a variety of reports and presentations for management, the Board and FHFA.
Translate data into written reports, tables, graphs and charts (including developing creative data visualizations to illustrate key findings); interpret data results to provide written commentary that articulates pertinent findings.
Support the development and refinement of performance metrics to evaluate the effectiveness of activities supporting the Bank’s Diversity and Inclusion Strategic Plan; perform ad-hoc analysis to enhance understanding of identified metrics.
Conduct research to provide insight on Bank’s performance trends and identified target ranges using publicly available industry and FHLBank system data; serve as a liaison to FHFA, the FHLBank System and other external data analysts specializing in diversity and inclusion.
Support operational functions of the Office including, but not limited to, Committee administrative support, coordination of communication materials, organization of exam-related document requests, D&I training, pulse surveys or focus groups, and annual review of policies and procedures.
Required Experience
Bachelor’s degree in business, economics, statistics or related field
Three years of related experience with strategic initiative project management, process and performance improvement, data analytics and reporting metrics
Experience in diversity and inclusion in the financial services industry is a plus
Highly proficient with Microsoft Office products; experience with Tableau or other data visualization tools
Proven track record with strong written and oral communication, analytical skills, data visualization and project management skills; high level of attention to detail and accuracy; ability to routinely manage large data sets
Strong interpersonal skills, self-motivated, and a demonstrated ability to multi-task and work independently while collaborating effectively at all levels of the Bank
It is the policy of the Federal Home Loan Bank of Pittsburgh to ensure equal employment opportunity (EEO) for all employees and applicants for employment without regard to race, religion, color, sex, national origin, age, disability status, genetic information, veteran's status, ancestry, sexual orientation or status as a parent as defined by applicable law. It is the Bank's policy to comply with applicable laws concerning the employment of persons with disabilities, including reasonable accommodation for applicants and employees with disabilities.",3.7,"FHLBank Pittsburgh
3.7","Pittsburgh, PA","Pittsburgh, PA",201 to 500 employees,1932,Company - Private,Banks & Credit Unions,Finance,$1 to $2 billion (USD),-1,0,0,44,58,51.0,"FHLBank Pittsburgh
", PA,1,88,0,0,0
