Salary Estimate,Job Description,Rating,Company Name,Location,Headquarters,Size,Founded,Type of ownership,Industry,Sector,Revenue,Competitors,hourly,employer_Provided,min_salary,max_salary,avg_salary,company_txt,job_state,some_state,age,python_yn,R_yn,Spark
$71K-$117K (Glassdoor est.),"At MassMutual, we are passionate about helping millions of people find financial freedom and this passion has driven our approach to developing meaningful experiences for our customers. The Data Science team, part of the Enterprise Technology and Experience organization, is comprised of highly skilled and collaborative problem solvers who are motivated to create innovative solutions that exceed the changing needs of our customers and move MassMutual and the industry forward.

To continue our cutting-edge work, we are hiring a Data Science Project Manager to join our team.

What great looks like for this role

A seasoned Project Manager will have the opportunity to apply advanced project and program management knowledge, skills, tools and techniques to project deliverables, processes, communications and presentations in order to meet or exceed stakeholder needs and expectations. The Project Manager will have the ability to think strategically to understand, apply, promote and contribute to MassMutual's delivery methodologies, standards and tools. This individual will work with a team that embraces diversity in all of its forms, respects others and looks to have fun.

Objectives of this role
To scale our data science impact.
To impact complex business goals through the delivery of quality work timely.
To ensure documentation is in place and process is followed meeting standards
Daily and Monthly Responsibilities - What You Will Do:
Lead broad scope projects that have medium to long-term focus
Engage with all levels across the enterprise
Serve as a conduit of knowledge between functional and technical teams
Communicate regularly with individuals both within and outside of our team, managing relationships and expectations
Navigate ambiguity to deliver results
Develop plans for continuous service to support implementation of products
Act as a champion for data science capabilities by communicating their benefits and how they can be implemented
Provide consultation, business analysis, project management, and leadership on multiple projects of varying duration, size, and complexity
Motivate teams to work together, communicate, and deliver
Elicit, translate and simplify requirements
Document and organize acceptance criteria for user stories
Manage budget, timeline, and scope throughout the course of all assigned projects
Lead project teams during all phases of the development life cycle including requirements gathering and analysis, design, build, pilot, implementation and continuous service
Facilitate client and project team interactions including: scrums, sprint planning, sprint retrospectives, sprint reviews, incident management and release management
Work with product managers to define improvements to business processes, assist decision-makers in gathering information to make decisions, and help quality assurance test solutions
Work with technical leads, product managers to plan, develop technical scopes of work and manage the execution of projects/product changes in response to requirements from our stakeholders
Be self-supportive in collaborating with peers to effectively deliver a robust solution for the business
Drive process within a matrix management setting
What You Will Not Do:
Design strategic roadmaps
Large amounts of computer programming
Manipulation of large data sets
Sit in solitude at your desk
Basic Qualifications
Bachelors Degree preferably in Business/Finance or an analytical field such as Economics, Mathematics, Engineering, Computer Science
4+ years managing and driving the execution of complex projects
Experience in/working in partnership with a technical role, such as an engineer, developer, data scientist, etc. a plus
Proficient with project management tools and techniques, such as JIRA, Confluence, Scrum and Kanban
Excellent interpersonal communication, conflict management, coordination, and planning skills with cross-functional teams
Skilled in applying judgment to balance process compliance with achievement of business objectives
Project leadership experience focused on engaging others in the delivery and execution of technical solutions and service deliverables
Ability to assess a project's scope and the team's ability to execute
Outcome oriented with the ability to drill down from the big picture to process details
Ability to communicate objectives, plans, status and results clearly
Strong leadership skills and influencer
Ability to collaborate across diverse teams and organizations
Strong organizational skills and detail oriented
Authorized to work in the United States without requiring visa sponsorship now or in the future
Preferred Qualifications
Masters Degree, preferably in Business/Finance or an analytical field such as Economics, Mathematics, Engineering, Computer Science
Agile certification or experience
Solid grasp of software technologies and stacks.
Former technical experience is preferred, such as working with data science teams or experience developing and/or deploying predictive models",3.7,"MassMutual
3.7","Boston, MA","Springfield, MA",5001 to 10000 employees,1851,Company - Private,Insurance Carriers,Insurance,$10+ billion (USD),-1,0,0,71,117,94.0,"MassMutual
", MA,0,169,0,0,0
$66K-$96K (Glassdoor est.),"HPOne, named CT Magazine's 2018 Great Places to Work, is looking for a Speech Analyst to join our team.

The Speech Analyst role works within the Speech Analytics team to help design and implement analytical solutions using a speech to text data mining software. This role would mainly work within the CallMiner software, but may be required to utilize SQL, R, Python or other coding languages in order to help complete team projects. This role requires a high level of analytical problem solving, a strong attention to detail, and a command of various technical platforms. As HPOne continues to grow and change, there will be a changing demand of skills. Thus, this role also prefers a level of adaptability to new demands from external and internal clients.

Detailed Responsibilities:
Creation and editing of CallMiner categories, scores, and search syntax
Build and customize ad-hoc analysis and long-term reporting solutions to support our business operations (sales effectiveness, compliance, and quality assurance) utilizing data analysis and visualization techniques via the CallMiner platform.
Responsible for conducting in-depth analysis compilation, validation, analysis and presentation.
Identify and integrate various data sources from our CRM, telephony, and other sources.
Analyze reports to monitor speech system performance.
Perform general user management and maintenance
Provide support for users of the CallMiner platform
Performs other related duties as assigned
Required Skills/Abilities:
High School diploma or equivalent
2+ years in a call center environment
Proficiency in Microsoft Excel (macros, formulas, pivots, etc.)
Basic understanding of data science principles
Strong written and verbal skills
Strong analytical and problem-solving skills
Ability to work with limited supervision
Preferred Skills/Abilities:
Bachelor's degree in a quantitative field such as computer science, economics, mathematics etc. or relevant experience
Speech Analytics software experience (preferably CallMiner)
1-year experience in the Medicare sales industry
Experience in DOMO, Tableau, AgentCubed, and/or InContact
Knowledge of SQL, R, Python, C#, and/or Java
Physical Requirements:
Prolonged periods of sitting at a desk and working on a computer, typically in an office or cubical environment (constant noise, fluorescent overhead lighting)
Equal Employment Opportunity (EEO) is a fundamental principle at HPOne, where employment is based upon personal capabilities and qualifications. HPOne does not discriminate because of actual or perceived sex, sexual orientation or preference, gender identity, gender, transgender, race, color, religion, national origin, creed, citizenship status, ancestry, age, marital status, pregnancy, childbirth or related medical conditions, medical conditions including genetic characteristics, mental or physical disability, military and veteran status, or any other protected characteristic as established by law. HPOne requires the necessary drug testing and background checks as part of our pre-employment practices.",3.5,"HPOne
3.5","Trumbull, CT","Trumbull, CT",501 to 1000 employees,2006,Company - Private,Insurance Carriers,Insurance,$50 to $100 million (USD),-1,0,0,66,96,81.0,"HPOne
", CT,1,14,1,0,0
$51K-$59K (Glassdoor est.),"Our Mission.
We make good things happen by recognizing and rewarding people for taking the high road. How? By reinventing insurance to celebrate people’s mindful choices.

Insurance was fundamentally a brilliant idea, but it always had a key challenge—it couldn’t identify and acknowledge the positive decisions that individuals made along the way. But when we apply smart mobile technologies, we can. And that’s what we do. We help our customers save on their monthly bill. But more importantly, they join a growing movement of people who dare to live more mindfully because doing so is simply better for everyone.

We’re a well-funded, elite team of people who care about using our skills to do good. From customer care to data science, design, engineering, insurance, product, research, user experience and beyond—we believe in people who believe they can make the world even better. Join us, and let’s build the higher path that is HiRoad.

The role.
We are seeking a Claims Specialist; a personable, self motivated, team member to help build a service experience that feels more like a high-end loyalty program. You will be a key early addition to our team working to quickly grow the company. Ultimately, you will be responsible for delivering an exceptional and personalized experience for our customers not typically found in our industry. This position is perfect for someone who wants to do something more exciting in insurance, be part of a new way to deliver it, and join an exciting company entering a new market.
Job Duties and Responsibilities:
Leverage appropriate job aids, expertise, and tools to accurately and consistently handle complex property and injury claims.
Works with minimal supervision to recognize, investigate, and resolve complex coverage, liability, injury, and damage issues.
Handle claims with injury diagnoses which may be inconsistent with the vehicle damage or loss characteristics.
Work with attorneys in the defense of first party and/or third party lawsuits with required management involvement which may include attending trials, arbitrations, mediations, and/or depositions.
Handle multiple exposures that create a potential for insufficient limits.
May serve as a resource for complex/non-routine claim issues.
Help develop and continuously improve standard claim.
May coordinate and lead special projects, as assigned.
May perform duties and responsibilities of the supervisor during his/her absence as delegated.
Communicate with customers to resolve claims.
Identify issues that may require the use of independent experts or vendors.
Assist in the training of less experienced claim handlers.
Additional responsibilities as assigned.
About You:
High school diploma required, Bachelor’s degree highly preferred
4+ years auto claims experience required
Experience handling complex liability, bodily injury, and total loss claims
Excellent verbal and written communication skills
Ability to manage relationships with internal and external customers
Self-managed, highly motivated, flexible and confident
Detail oriented with strong organizational skills, and ability to multi-task
Able to work well under deadlines in a high-paced, changing environment
Great organizational skills - has the ability to manage large volume of work and prioritize items accordingly
Works well under stressful conditions
Ability to acquire adjusters license within 45 days of hire
Current adjusters license preferred
Bonus points - previous rental or fire claims experience
Other Info:
Benefits: medical, dental, vision and retirement; wellness stipend, four weeks of vacation + six weeks of parental leave; Providence office location off Federal Hill with lots of exposed brick and sunlight.
Great work/life balance with a comprehensive benefits program designed to help you and your family thrive.
Includes paid parking
Role based in our cool new Rhode Island office, set up to encourage innovation and collaboration.
Fun, high-energy, results-oriented work environment in a mission-driven organization.
HiRoad is an equal opportunity employer. We are committed to equal employment opportunity regardless of race, color, ancestry, religion, sex, national origin, sexual orientation, age, citizenship, marital status, disability, gender identity or veteran status.",5.0,"HiRoad
5.0","Providence, RI","Bloomington, IL",1 to 50 employees,-1,Company - Private,Insurance Carriers,Insurance,Unknown / Non-Applicable,"Progressive Insurance, GEICO, Esurance",0,0,51,59,55.0,"HiRoad
", RI,0,-1,0,0,0
$99K-$116K (Glassdoor est.),"*Organization and Job ID**
Job ID: 310677

Directorate: Energy and Environment

Division: Earth Systems Science

Group:Risk and Decision Sciences
*Job Description**
The Risk and Decision Sciences Group (RDS) at Pacific Northwest National Laboratory (PNNL) provides an opportunity to work in a dynamic environment solving challenging problems with national and international impact. The RDS team develops novel analytical methods and integrates them with state-of-the-art technologies to help clients define the decision workspace, prioritize risks, and develop defensible risk management strategies. The team provides innovative solutions throughout the entire decision-making process that serve as the foundation for developing and communicating strategies to minimize risks to individuals or the public, program life cycles, facility designs and operations, and the environment.

We are seeking a Data Scientist to assist in analyzing and implementing data-driven solutions to problems specific to risk analysis projects and programs. The qualified candidate will support the RDS team, which develops strategic approaches in a diverse range of nuclear and other science-related projects, including project risk, regulatory assessments, and engineering alternative studies. The qualified candidate shall demonstrate proficiency in the following skill sets:

+ Applies knowledge of statistics, mathematics, simulation, software development, domain knowledge, and data modeling to recognize patterns, address uncertainty, pose relevant questions, and make discoveries from structured and/or unstructured data.

+ Designs, develops, and implements methods, processes, and systems to clean and integrate diverse data for analysis.

+ Designs, develops, and evaluates models/advanced algorithms that lead to insight and/or value extraction from data.

+ Produces solutions driven by exploratory data analysis, often from complex and high-dimensional datasets.

+ Demonstrates ability to transfer skills across application domains.

Primary responsibilities include:

+ Ensuring that technical products for assigned tasks are delivered with the required level of quality, timeliness, and cost to meet or exceed sponsor expectations.

+ Participating in interdisciplinary engineering and scientific project teams and may interact with sponsors.

+ Exhibiting personal responsibility for and commitment to continued career development, performing organizational roles, complying with organizational requirements, taking action to ensure personal safety and the safety of others always.

+ Contributing to the technical content of proposals.

+ Providing technical support at various stages of the risk management cycle.

+ Interpreting results to identify issues, inconsistencies, and other problems.

+ Proactively identifying, promoting, and developing new technical capabilities.

+ Independently managing and completing recurring project specific tasks.

+ Working autonomously but seeking technical guidance when needed.
*The hiring level will be determined based on the education, experience and skill set of the successful candidate based on the following:**
*Level I:** Applies basic data science practice to well defined tasks with minimal oversight, but requires development of conceptual knowledge with regard to scientific or engineering practices within specialization. Building and maintaining effective internal relationships on individual or team level. Receives instruction on required tasks and reports results on time and on budget, while working under guidance from experienced staff. Takes initiative to set personal direction and goals. Contributes to technical publications and reports. BS/BA with 2 years of experience, MS/MA with 0-1 years of experience.
*Level II:** Building a reputation in the field of data science through diverse application of science and engineering principles and theories and develops novel technical approaches. Effectively teaming to share resources and optimize research at the group and division level. Receives guidance on new assignments, making preliminary selections on technical alternatives; independently completes recurring assignments. Defines and leads project work at a small task/project level, reporting results on time and on budget. Contributes to proposals. BS/BA with 2 years of experience, MS/MA with 0-1 years of experience, or PhD with 0-1 years of experience.
*Accountabilities:**
The successful candidate will be accountable to:

+ The Risk and Decision Sciences Group Lead (or delegate) for general staff performance and development, operational discipline (e.g., maintaining training qualifications, procedural compliance, safe operations), and promoting cooperation and teamwork within group and projects.

+ Program/Project Managers and Technology Leads for performing assigned project roles and following applicable project and laboratory procedures and performance of assigned tasks on time and within budget.
*Minimum Qualifications**
+ BS/BA with 0-1 years of experience or MS/MA with 0-1 years of experience.

+ The ability to obtain for a Q Clearance.
*Preferred Qualifications**
+ BS/BA with 2 years of experience, MS/MA with 0-1 years of experience, or PhD with 0-1 years of experience.

+ Degree from an accredited college/university in a technical field, preferably, although not necessarily, Mathematics, Engineering, Operations Research, Statistics, Data Science, or Economics.

+ Knowledge of and practical experience in use of quantitative risk models. This would also include an understanding of expert elicitation methods, Monte Carlo analysis, and decision tools.

+ The successful candidate will have a range of skills and familiarity with several of the following areas: probability, statistics, decision analysis, risk analysis, modeling and simulation, Multi-Criteria Analysis, and mathematical modeling.

+ Familiarity with Microsoft Project or Primavera P6

+ Past performance must demonstrate attributes of being self-motivated and self-directed, aptitude in managing multiple projects and successfully contributing to interdisciplinary teams.

+ In addition to analytical skills, a successful candidate will have excellent written and oral communications skills and experience in preparing, reviewing, and presenting the results of complex technical reports and recommendation to senior management.
*Equal Employment Opportunity**
Battelle Memorial Institute (BMI) at Pacific Northwest National Laboratory (PNNL) is an Affirmative Action/Equal Opportunity Employer and supports diversity in the workplace. All employment decisions are made without regard to race, color, religion, sex, national origin, age, disability, veteran status, marital or family status, sexual orientation, gender identity, or genetic information. All BMI staff must be able to demonstrate the legal right to work in the United States. BMI is an E-Verify employer. Learn more at jobs.pnnl.gov.
*_Please be aware that the Department of Energy (DOE) prohibits DOE employees and contractors from participation in certain foreign government talent recruitment programs. If you are offered a position at PNNL and are currently a participant in a foreign government talent recruitment program you will be required to disclose this information before your first day of employment._**
*Closing Statement**
+ U.S. Citizenship

+ Background Investigation: Applicants selected will be subject to a Federal background investigation and must meet eligibility requirements for access to classified matter in accordance 10 CFR 710, Appendix B.

+ Drug Testing: All Security Clearance (L or Q) positions will be considered by the Department of Energy to be Testing Designated Positions which means that they are subject to applicant, random, and for cause drug testing. In addition, applicants must be able to demonstrate non-use of illegal drugs, including marijuana, for the 12 consecutive months preceding completion of the requisite Questionnaire for National Security Positions (QNSP).

_Directorate:_ _Energy & Environment_

_Job Category:_ _Scientists/Scientific Support_

_Group:_ _Risk & Decision Sciences_

_Opening Date:_ _2020-03-24_

_Closing Date:_ _2020-04-17_",3.8,"PNNL
3.8","Richland, WA","Richland, WA",1001 to 5000 employees,1965,Government,Energy,"Oil, Gas, Energy & Utilities",$500 million to $1 billion (USD),"Oak Ridge National Laboratory, National Renewable Energy Lab, Los Alamos National Laboratory",0,0,99,116,107.5,"PNNL
", WA,1,55,0,0,0
